{
 "packId": "jyotish",
 "packName": "Jyotish",
 "version": 1,
 "ordering": "daily",
 "description": "The classical classification tables of phalit jyotish - the rashis, the grahas, the twelve bhavas, the friendships, the aspects and the principal yogas. Described from the Parashari texts; no translated text is copied.",
 "items": [
  {
   "id": "j-rashi-class",
   "text": "Classifying the twelve rashis",
   "translations": {"en": "A rashi is not just a slice of the zodiac. The texts classify each one by element (fire, earth, air, water), by movement (chara movable, sthira fixed, dwisvabhava dual), by gender, by caste (varna), by temperament (krura harsh or saumya gentle), by body (dwi-pada, chatus-pada, bahu-pada or keeta), by how it rises (shirshodaya head-first, prishtodaya hind-first, ubhayodaya both), and by which of sattva, rajas and tamas predominates.", "hi": "", "mr": ""},
   "summary_1line": "Seven ways the texts sort the signs",
   "summary_2to3line": "A rashi is classified by element, by movement (chara, sthira, dwisvabhava), by gender, by varna, by temperament (krura or saumya), by body, by how it rises, and by guna.",
   "bodh_3to4line": "These classifications are the vocabulary of prediction: a planet in a fixed sign behaves with more inertia than the same planet in a movable one, and a planet in a water sign carries a different flavour from the same planet in fire. Nothing here is interpretation yet - it is the table you interpret with.",
   "tags": ["jyotish", "rashi"],
   "steps": [
    "Movable (chara): Aries, Cancer, Libra, Capricorn.",
    "Fixed (sthira): Taurus, Leo, Scorpio, Aquarius.",
    "Dual (dwisvabhava): Gemini, Virgo, Sagittarius, Pisces.",
    "Fire: Aries, Leo, Sagittarius. Earth: Taurus, Virgo, Capricorn. Air: Gemini, Libra, Aquarius. Water: Cancer, Scorpio, Pisces.",
    "Male signs: Aries, Gemini, Leo, Libra, Sagittarius, Aquarius. Female: the other six.",
    "Harsh (krura): Aries, Gemini, Leo, Libra, Sagittarius, Aquarius - the odd signs. Gentle (saumya): the even signs.",
    "Human (manushya): Gemini, Virgo, Libra, Aquarius and the first half of Sagittarius. Animal: Aries, Taurus, Leo and the second half of Sagittarius. Keeta (insect): Cancer, Scorpio, Pisces. Quadruped (chatuspada): Aries, Taurus, Leo, the second half of Sagittarius and the first half of Capricorn."
   ]
  },
  {
   "id": "j-rashi-lords",
   "text": "Rashis and their lords",
   "translations": {"en": "Aries and Scorpio are Mars's; Taurus and Libra Venus's; Gemini and Virgo Mercury's; Cancer the Moon's; Leo the Sun's; Sagittarius and Pisces Jupiter's; Capricorn and Aquarius Saturn's.", "hi": "", "mr": ""},
   "summary_1line": "Which graha rules which sign",
   "summary_2to3line": "Aries and Scorpio are Mars's; Taurus and Libra Venus's; Gemini and Virgo Mercury's; Cancer the Moon's; Leo the Sun's; Sagittarius and Pisces Jupiter's; Capricorn and Aquarius Saturn's.",
   "bodh_3to4line": "The lord of a bhava is the ruler of the sign on its cusp, and most prediction works through the lord: where it sits, what it is with, and how strong it is. The Sun and Moon own one sign each, and the nodes own none - they are shadow planets.",
   "tags": ["jyotish", "rashi"]
  },
  {
   "id": "j-rashi-organs",
   "text": "Rashis and the body",
   "translations": {"en": "The zodiac is mapped onto the body from head to foot: Aries the head, Taurus the face and neck, Gemini the shoulders and arms, Cancer the chest and heart area, Leo the stomach and upper back, Virgo the abdomen and intestines, Libra the kidneys and lower back, Scorpio the generative organs, Sagittarius the hips and thighs, Capricorn the knees, Aquarius the calves and ankles, Pisces the feet.", "hi": "", "mr": ""},
   "summary_1line": "The sign-to-limb correspondence",
   "summary_2to3line": "The zodiac is mapped onto the body from head to foot, Aries the head through Pisces the feet.",
   "bodh_3to4line": "This is the basis of the medical astrology the texts use - an afflicted sign points at the limb it governs. It is traditional correspondence, not diagnosis.",
   "tags": ["jyotish", "rashi", "body"]
  },
  {
   "id": "j-graha-karaka",
   "text": "The karakatvas of the grahas",
   "translations": {"en": "The Sun signifies the soul, the father, authority, vitality and the bones. The Moon the mind, the mother, the emotions and the blood. Mars energy, courage, brothers, land and injury. Mercury speech, intellect, trade and writing. Jupiter wisdom, children, fortune and the guru. Venus love, marriage, beauty, vehicles and comfort. Saturn time, discipline, labour, sorrow and longevity. Rahu obsession, foreign things and illusion; Ketu detachment, moksha and the past.", "hi": "", "mr": ""},
   "summary_1line": "What each planet signifies",
   "summary_2to3line": "Sun soul and father, Moon mind and mother, Mars energy and brothers, Mercury speech and intellect, Jupiter wisdom and children, Venus love and comfort, Saturn time and discipline, Rahu obsession, Ketu detachment.",
   "bodh_3to4line": "These karakatvas are the sense in which a planet 'owns' a matter. When several planets carry the same karakatva, that matter is emphasised in the chart; when the karaka is afflicted, the matter suffers. This is the common list found across the Parashari texts.",
   "tags": ["jyotish", "graha"]
  },
  {
   "id": "j-graha-exalt",
   "text": "Exaltation, debilitation and moolatrikona",
   "translations": {"en": "Every planet has a sign where it is exalted (uccha) and therefore strongest, a sign where it is debilitated (neecha) and weakest, and a sign it owns where a particular portion is its moolatrikona - its own home ground, stronger than ordinary ownership.", "hi": "", "mr": ""},
   "summary_1line": "Where each planet is strongest and weakest",
   "summary_2to3line": "Each planet has an exaltation sign, a debilitation sign, and a moolatrikona - its own home ground, stronger than ordinary ownership.",
   "bodh_3to4line": "The degrees matter. The Sun is exalted at 10 degrees of Aries and debilitated at 10 of Libra; the Moon at 3 of Taurus and 3 of Scorpio; Mars at 28 of Capricorn and 28 of Cancer; Mercury at 15 of Virgo and 15 of Pisces; Jupiter at 5 of Cancer and 5 of Capricorn; Venus at 27 of Pisces and 27 of Virgo; Saturn at 20 of Libra and 20 of Aries. Moolatrikona: the Sun in Leo, the Moon in Taurus, Mars in Aries, Mercury in Virgo, Jupiter in Sagittarius, Venus in Libra, Saturn in Aquarius.",
   "tags": ["jyotish", "graha", "strength"]
  },
  {
   "id": "j-graha-friendship",
   "text": "Natural friendship between the grahas",
   "translations": {"en": "The Sun counts the Moon, Mars and Jupiter as friends, Mercury as neutral, and Venus and Saturn as enemies. The Moon counts the Sun and Mercury as friends and the rest as neutral. Mars counts the Sun, Moon and Jupiter as friends and Mercury as an enemy. Mercury counts the Sun and Venus as friends and the Moon as an enemy. Jupiter counts the Sun, Moon and Mars as friends, Saturn as neutral and Mercury and Venus as enemies. Venus counts Mercury and Saturn as friends and the Sun and Moon as enemies. Saturn counts Mercury and Venus as friends and the Sun, Moon and Mars as enemies.", "hi": "", "mr": ""},
   "summary_1line": "Who is whose friend, by nature",
   "summary_2to3line": "A fixed table of natural friendship, given per planet in the classical texts.",
   "bodh_3to4line": "Natural friendship is inherent to the planets and never changes. It is only one half of the picture - the other half is temporal, and the two combine into the five-fold relationship. The nodes are generally not given natural friendship, as they own no sign.",
   "tags": ["jyotish", "graha", "friendship"]
  },
  {
   "id": "j-graha-tatkalik",
   "text": "Temporary friendship",
   "translations": {"en": "Tatkalik maitri is friendship by placement in the chart. A planet treats as its temporary friends the planets sitting in the 2nd, 3rd, 4th, 10th, 11th and 12th houses from itself, and as temporary enemies those in the 1st, 5th, 6th, 7th, 8th and 9th.", "hi": "", "mr": ""},
   "summary_1line": "Who is whose friend, by position",
   "summary_2to3line": "A planet treats as temporary friends the planets in the 2nd, 3rd, 4th, 10th, 11th and 12th houses from itself, and as enemies those in the 1st, 5th, 6th, 7th, 8th and 9th.",
   "bodh_3to4line": "This is why the same two planets can be friends in one chart and enemies in another. It is computed from the chart, so it needs the positions of all the planets - which the Kundli screen now has.",
   "tags": ["jyotish", "graha", "friendship"]
  },
  {
   "id": "j-graha-panchadha",
   "text": "The five-fold relationship (panchadha maitri)",
   "translations": {"en": "Natural friend plus temporal friend is adhi mitra, a great friend. Natural friend plus temporal enemy, and natural enemy plus temporal friend, both reduce to sama, neutral. Natural neutral plus temporal friend is mitra. Natural neutral plus temporal enemy is shatru. Natural enemy plus temporal enemy is adhi shatru.", "hi": "", "mr": ""},
   "summary_1line": "Natural and temporary friendship combined",
   "summary_2to3line": "Combining the two tables gives five relationships: adhi mitra, mitra, sama, shatru and adhi shatru.",
   "bodh_3to4line": "This is the relationship the texts actually use when judging whether two planets will help or harm each other. It is computable from the chart, and the Kundli screen shows it.",
   "tags": ["jyotish", "graha", "friendship"]
  },
  {
   "id": "j-graha-aspects",
   "text": "Aspects (drishti)",
   "translations": {"en": "Every planet aspects the 7th house from itself with a full glance. Beyond that, Mars also aspects the 4th and 8th, Jupiter the 5th and 9th, and Saturn the 3rd and 10th.", "hi": "", "mr": ""},
   "summary_1line": "Which house each planet looks at",
   "summary_2to3line": "All planets aspect the 7th from themselves; Mars also the 4th and 8th, Jupiter the 5th and 9th, and Saturn the 3rd and 10th.",